title,description,publishedAt,source,url,lat,lon,semantic_cluster,geo_cluster,days_ago,recency_score,severity,risk_score,risk_level
"Army must rebuild ties with Gujjar, Bakerwal tribes to prevent intelligence gap on ground, say experts",A shift in terror tactics towards higher ridges in Jammu and Kashmir necessitates a review of security strategies and a restoration of trust with the Gujjar and Bakerwal communities. Incidents like the Kathua rape case and the Topa Pir killings have eroded th…,2025-09-21 06:48:10,The Times of India,https://economictimes.indiatimes.com/news/defence/army-must-rebuild-ties-with-gujjar-bakerwal-tribes-to-prevent-intelligence-gap-on-ground-say-experts/articleshow/124025034.cms,,,6,-1,2,0.9333333333333333,5,1,High
"Nepal at crossroads, bid to establish people's rule may get dashed before it truly began: Analysts","Nepal faces political instability after the government's collapse. Protests and violence erupted, leading to army intervention. Analysts suggest potential solutions beyond the existing constitution. Options include an interim government or a complete constitu…",2025-09-11 03:27:35,The Times of India,https://economictimes.indiatimes.com/news/international/world-news/nepal-at-crossroads-bid-to-establish-peoples-rule-may-get-dashed-before-it-truly-began-analysts/articleshow/123820990.cms,,,-1,-1,12,0.6,2,1,High
Shooting attack on Jerusalem bus kills 4,A tragic shooting incident occurred in Jerusalem. Attackers opened fire on a bus at a busy intersection. Initial reports confirm at least four fatalities. Fifteen individuals sustained injuries in the attack. Security forces neutralized two attackers soon aft…,2025-09-08 08:07:04,The Times of India,https://economictimes.indiatimes.com/news/international/world-news/shooting-attack-on-jerusalem-bus-kills-4/articleshow/123761160.cms,,,2,-1,15,0.5,1,1,High
"Escaped murderous assault from Tihar inmates, alleges LS MP Engineer Rashid","Engineer Rashid, a jailed Lok Sabha member, claims he survived an attack in Tihar jail. He alleges a plot against Kashmiri inmates. Rashid's party demands an investigation. He reports that inmates with HIV are placed in their barracks to instigate attacks. Ot…",2025-09-05 19:01:19,The Times of India,https://economictimes.indiatimes.com/news/politics-and-nation/escaped-murderous-assault-from-tihar-inmates-alleges-ls-mp-engineer-rashid/articleshow/123725264.cms,,,-1,-1,17,0.43333333333333335,5,1,High
9/11: Why did Osama bin Laden attack the United States?,"The 9/11 attacks, a culmination of escalating tensions between Osama bin Laden and the U.S., were rooted in grievances over American presence in Saudi Arabia, sanctions on Iraq, and support for Israel. Bin Laden's ideology framed the killing of Americans as a…",2025-09-11 06:09:06,The Times of India,https://economictimes.indiatimes.com/news/international/global-trends/9/11-why-did-osama-bin-laden-attack-the-united-states/articleshow/123823519.cms,,,2,-1,12,0.6,1,1,High
‘Will pay for it’: WWE legend Jeff Jarrett blasts Raja Jackson for brutal attack on wrestler during event in Los Angeles,"Raja Jackson assaulted a wrestler at a Los Angeles event. WWE Hall of Famer Jeff Jarrett condemned the act. He said Jackson will 'pay for it.' The LAPD is investigating the incident. Rampage Jackson, Raja's father, reported receiving threats. Raja is banned f…",2025-09-01 19:34:32,The Times of India,https://economictimes.indiatimes.com/news/international/us/will-pay-for-it-wwe-legend-jeff-jarrett-blasts-raja-jackson-for-brutal-attack-on-wrestler-during-event-in-los-angeles/articleshow/123643098.cms,,,3,-1,21,0.30000000000000004,3,1,High
Streaming platform Kick bans Raja Jackson after brutal 20-punch assault on Syko Stu. All about Quinton Rampage's son,"Raja Jackson, son of MMA legend Quinton “Rampage” Jackson, is facing severe backlash after a disturbing video surfaced showing him brutally attacking wrestler Syko Stu during a Knokx Pro Wrestling event. The incident, streamed live on Kick, led to Jackson's b…",2025-08-24 13:52:04,The Times of India,https://economictimes.indiatimes.com/news/international/global-trends/us-news-streaming-platform-kick-bans-raja-jackson-after-brutal-20-punch-assault-on-syko-stu-all-about-quinton-rampages-son/articleshow/123485011.cms,,,3,-1,29,0.033333333333333326,3,1,High
At least 60 people were killed in an overnight rebel attack in eastern Congo,"In eastern Congo, a brutal attack has claimed the lives of at least 60 individuals. The Allied Democratic Force, linked to the Islamic State, reportedly carried out the assault in Ntoyo, North Kivu. The victims were gathered for a burial when the rebels struc…",2025-09-09 09:43:07,The Times of India,https://economictimes.indiatimes.com/news/international/world-news/at-least-60-people-were-killed-in-an-overnight-rebel-attack-in-eastern-congo/articleshow/123783582.cms,,,2,-1,14,0.5333333333333333,3,1,High
British PIO woman says 'raped' by two white men in West Midlands,"India News: LONDON: A British-born Sikh woman in her 20s was sexually assaulted, raped and beaten in a racially motivated attack on Tuesday in Oldbury, near Birmi.",2025-09-12 20:15:26,The Times of India,https://timesofindia.indiatimes.com/india/british-pio-woman-says-raped-by-two-white-men-in-west-midlands/articleshow/123859330.cms,,,0,-1,10,0.6666666666666667,3,1,High
Poland scrambles fighter jets after Russia launches massive aerial attack on Ukraine,"Poland and allied military aircraft were scrambled Saturday, September 20, after Russia launched a massive aerial assault on Ukraine near Poland's western border. The attack included 579 drones and missiles, killing eight people and injuring at least 32 over …",2025-09-20 20:49:16,The Times of India,https://economictimes.indiatimes.com/news/international/us/poland-scrambles-fighter-jets-after-russia-launches-massive-aerial-attack-on-ukraine/articleshow/124021006.cms,,,2,-1,2,0.9333333333333333,3,1,High
Why did Minneapolis school shooter choose August 27 for the deadly attack? Disturbing manifesto reveals reason,"The Minneapolis school attacker chose August 27 to open fire outside of a church at a Catholic school killing two children, aged eight and ten, and injuring dozens. The shooter Robin Westman wanted to kill as many children possible, the disturbing manifesto u…",2025-08-29 16:07:06,The Times of India,https://economictimes.indiatimes.com/news/international/global-trends/us-news-why-did-minneapolis-school-shooter-choose-august-27-for-the-deadly-attack-disturbing-manifesto-reveals-reason/articleshow/123588174.cms,,,1,-1,24,0.19999999999999996,1,1,High
Qatar official says Netanyahu 'killed any hope' of hostage release with its strike in Doha on Hamas,"Qatar's prime minister has strongly criticized Israel's attack targeting Hamas leaders, asserting that it jeopardizes hostage release efforts. Sheikh Mohammed bin Abdulrahman Al Thani believes Netanyahu's actions have undermined any hope for the hostages' fre…",2025-09-11 06:27:07,The Times of India,https://economictimes.indiatimes.com/news/defence/qatar-official-says-netanyahu-killed-any-hope-of-hostage-release-with-its-strike-in-doha-on-hamas/articleshow/123823899.cms,,,2,-1,12,0.6,1,1,High
"Israel will kill Hamas leaders next time if they survived Qatar attack, Israeli official says","An Israeli strike in Doha, targeting Hamas leaders, has sparked international concern and threatens to derail ceasefire negotiations in Gaza. Despite failing to eliminate its targets, Israel vows to persist, drawing condemnation from Qatar and China. Arab sta…",2025-09-10 10:57:36,The Times of India,https://economictimes.indiatimes.com/news/defence/israel-will-kill-hamas-leaders-next-time-if-they-survived-qatar-attack-israeli-official-says/articleshow/123807841.cms,,,2,-1,13,0.5666666666666667,1,1,High
Russian glide bomb attack in eastern Ukraine kills at least 24 people collecting their pensions,"A Russian glide bomb struck Yarova, a village in eastern Ukraine, killing at least 24 people and injuring 19 others. The attack occurred as residents lined up to collect their monthly pensions. Ukrainian President Volodymyr Zelenskyy condemned the ""brutal"" ac…",2025-09-09 15:57:08,The Times of India,https://economictimes.indiatimes.com/news/defence/russian-glide-bomb-attack-in-eastern-ukraine-kills-at-least-24-people-collecting-their-pensions/articleshow/123790253.cms,,,2,-1,13,0.5666666666666667,1,1,High
US and allies see yearslong hack as China's most ambitious yet,"A sweeping cyberattack, dubbed Salt Typhoon and attributed to China, has targeted over 80 countries, potentially compromising data from nearly every American. Officials describe the attack as a years-long, coordinated assault on telecommunications and other c…",2025-09-05 03:32:26,The Times of India,https://economictimes.indiatimes.com/news/international/world-news/us-and-allies-see-yearslong-hack-as-chinas-most-ambitious-yet/articleshow/123710683.cms,,,-1,-1,18,0.4,3,1,High
Charlie Kirk shooting: How culture-war opportunism turbocharged the attack on US higher education,"The killing of conservative activist Charlie Kirk has ignited a fierce debate that places American universities in the dock. While the accused had only brief ties to higher education, attention has shifted to faculty remarks, with over a dozen educators disci…",2025-09-17 11:23:21,The Times of India,https://timesofindia.indiatimes.com/education/news/charlie-kirk-shooting-culture-war-opportunism-attack-on-us-higher-ed/articleshow/123943913.cms,,,1,-1,5,0.8333333333333334,1,1,High
One-and-a-half-year-old boy killed in leopard attack in Maharashtra's Sinnar,"In a tragic incident, a one-and-a-half-year-old boy was killed by a leopard in Sinnar taluka, Nashik district, marking the second such fatality in a week. The attack occurred near Nimgaon-Deopur village as the boy was with his family at their farm.",2025-09-14 06:24:57,The Times of India,https://timesofindia.indiatimes.com/city/nashik/one-and-a-half-year-old-boy-killed-in-leopard-attack-in-maharashtras-sinnar/articleshow/123879301.cms,,,-1,-1,9,0.7,1,1,High
Charlie Kirk's assassination: What is known about the aftermath,"As Utah prepares for court proceedings that could result in the state’s most high-profile capital case in years, the broader debate over political extremism and violence in America is likely to intensify further.",2025-09-17 00:41:58,The Times of India,https://economictimes.indiatimes.com/news/international/global-trends/charlie-kirks-assassination-what-is-known-about-the-aftermath/articleshow/123932910.cms,,,1,-1,6,0.8,2,1,High
"""Idiots don't understand Idioms"": Mahua Moitra's jibe at BJP after her remarks on Amit Shah","TMC MP Mahua Moitra has strongly defended her remarks against Amit Shah, claiming they were misinterpreted idioms and not a call for violence. An FIR was filed against her for allegedly promoting enmity, but Moitra accused the BJP of twisting her words and us…",2025-08-31 17:39:49,The Times of India,https://economictimes.indiatimes.com/news/politics-and-nation/idiots-dont-understand-idioms-mahua-moitras-jibe-at-bjp-after-her-remarks-on-amit-shah/articleshow/123619230.cms,,,-1,-1,22,0.2666666666666667,2,1,High
"Charlie Kirk Shooter All Conspiracy Theories Explained: Here's all about vantage points, rooftop footage, hand signals and social media claims","Charlie Kirk shooter all conspiracy theories have been explained as the FBI appeals for tips in the Utah Valley University killing. Theories circulate about vantage points, rooftop footage, hand signals and social media claims while the manhunt continues.",2025-09-11 13:14:23,The Times of India,https://economictimes.indiatimes.com/news/international/us/charlie-kirk-shooter-all-conspiracy-theories-explained-fbi-seeks-tips-utah-valley-university-conservative-activist-turning-point-usa-vantage-points-rooftop-footage-hand-signals-social-media-claims-manhunt/articleshow/123831839.cms,,,1,-1,11,0.6333333333333333,1,1,High
"Charlie Kirk's critics to be deported from U.S.? Many lost jobs, face online threats, claim reports",Charlie Kirk's death sparked sharp debates on the social media platforms. Republicans' anger at those disrespecting Charlie Kirk's legacy contrasts with the mockery some of the same figures – including Kirk – directed at past victims of political violence.,2025-09-13 15:59:44,The Times of India,https://economictimes.indiatimes.com/news/international/us/charlie-kirks-critics-to-be-deported-from-u-s-many-lost-jobs-face-online-threats-claim-reports/articleshow/123871630.cms,,,1,-1,9,0.7,2,1,High
FBI releases photos of person of interest in Charlie Kirk's Utah university campus killing,"The FBI is seeking public assistance in the assassination of Charlie Kirk, releasing photos of a person of interest and offering a $100,000 reward. Kirk, a prominent ally of Donald Trump, was fatally shot at Utah Valley University, prompting widespread condem…",2025-09-11 18:21:25,The Times of India,https://economictimes.indiatimes.com/news/international/global-trends/fbi-releases-photos-of-person-of-interest-in-charlie-kirks-utah-university-campus-killing/articleshow/123836494.cms,,,1,-1,11,0.6333333333333333,1,1,High
What is Antifa - will Trump designate it as domestic terror organization? What could be the consequences?,"President Donald Trump stated on Monday that he would consider designating Antifa as domestic terrorists, naming the far-left movement part of a larger coalition of radicals showing violence. “It’s something I would do, yeah,” he said to reporters, mentioning…",2025-09-16 18:35:04,The Times of India,https://economictimes.indiatimes.com/news/international/us/what-is-antifa-will-trump-designate-it-as-domestic-terror-organization-what-could-be-the-consequences/articleshow/123928207.cms,,,-1,-1,6,0.8,2,1,High
Chandramouli Nagamallaiah murder: Trump administration plans to deport murderer of Indian national to Cuba,"Two days after an Indian national, Chandra Nagamallaiah was brutally murdered and decapitated by an undocumented immigrant from Cuba, the US Department of Homeland Security (DHS) announced that Immigration and Customs Enforcement (ICE) has started the process…",2025-09-13 00:59:17,The Times of India,https://economictimes.indiatimes.com/news/india/chandramouli-nagamallaiah-murder-trump-administration-plans-to-deport-murderer-of-indian-national-to-cuba/articleshow/123862041.cms,,,5,-1,10,0.6666666666666667,5,1,High
"'I'm going to take it': Suspected Charlie Kirk killer allegedly left a note saying he planned to kill , later confessed in texts","Tyler Robinson has been charged with the murder of Charlie Kirk, with prosecutors citing a text confession and a note indicating Robinson's intent to kill Kirk due to his ""hatred."" The shooting occurred after weeks of planning, with Robinson using a rifle fro…",2025-09-17 02:05:28,The Times of India,https://economictimes.indiatimes.com/news/international/global-trends/im-going-to-take-it-suspected-charlie-kirk-killer-left-a-note-saying-he-planned-to-kill-later-confessed-in-texts/articleshow/123933359.cms,,,1,-1,6,0.8,5,1,High
"At least 25 killed in Pakistan attacks, including 14 at political rally","A series of attacks in Pakistan on Tuesday resulted in at least 25 fatalities. A suicide bombing at a Balochistan National Party rally in Quetta killed 14 and wounded dozens. Separately, five paramilitary personnel died near the Iranian border, and six soldie…",2025-09-03 00:40:25,The Times of India,https://economictimes.indiatimes.com/news/international/world-news/at-least-25-killed-in-pakistan-attacks-including-14-at-political-rally/articleshow/123667041.cms,,,2,-1,20,0.33333333333333337,1,1,High
EU summons Russian envoy after mission damaged in Kyiv strike,"The EU summoned Moscow's envoy in Brussels on Thursday after a massive attack on Kyiv killed at least 14 people and damaged the bloc's diplomatic mission in the city. EU foreign policy chief Kaja Kallas announced on X that the bloc was ""summoning the Russian …",2025-08-28 11:21:26,The Times of India,https://economictimes.indiatimes.com/news/international/world-news/eu-summons-russian-envoy-after-mission-damaged-in-kyiv-strike/articleshow/123563523.cms,,,2,-1,25,0.16666666666666663,1,1,High
"'Out for walk with dog': 2 juveniles, youth axe 25-year-old man to death in Chhattisgarh; held","In Chhattisgarh's Raigarh district, a 25-year-old man, Sujit Xalxo, was brutally murdered with an axe by a 19-year-old and two minors due to a long-standing feud. The incident occurred after an argument escalated, leading the accused to attack the victim when…",2025-08-30 03:13:27,The Times of India,https://timesofindia.indiatimes.com/city/raipur/out-for-walk-with-dog-2-juveniles-youth-axe-25-year-old-man-to-death-in-chhattisgarh-held/articleshow/123594919.cms,,,-1,-1,24,0.19999999999999996,5,1,High
EU summons Russian envoy after mission damaged in Kyiv strike,"The EU summoned Moscow's envoy in Brussels on Thursday after a massive attack on Kyiv killed at least 14 people and damaged the bloc's diplomatic mission in the city. EU foreign policy chief Kaja Kallas announced on X that the bloc was ""summoning the Russian …",2025-08-28 11:21:26,The Times of India,https://economictimes.indiatimes.com/news/international/world-news/eu-summons-russian-envoy-after-mission-damaged-in-kyiv-strike/articleshow/123563523.cms,,,2,-1,25,0.16666666666666663,1,1,High
Minneapolis shooter 'obsessed' with killing children,"A 23-year-old shooter, once a student, opened fire at Annunciation Catholic School in Minneapolis, killing two children and wounding fifteen others, along with three parishioners. FBI Director Kash Patel labeled the attack as domestic terrorism fueled by hate…",2025-08-29 15:23:24,The Times of India,https://timesofindia.indiatimes.com/world/us/minneapolis-shooter-obsessed-with-killing-children/articleshow/123587743.cms,,,1,-1,24,0.19999999999999996,1,1,High
Woman stabbed to death over allegations of witchcraft in Madhepura,"In Madhepura district's Vanshgopal village, Mehroon Khatun was murdered. Accusations of witchcraft led to the brutal attack. A group attacked her with knives near her home. She suffered multiple stab wounds and died. Police are investigating a prior argument …",2025-09-07 16:50:57,The Times of India,https://timesofindia.indiatimes.com/city/patna/woman-stabbed-to-death-over-allegations-of-witchcraft-in-madhepura/articleshow/123749729.cms,,,7,-1,15,0.5,5,1,High
Modi's visit to strengthen India's ties with SCO: Rajnath,Defence Minister Rajnath Singh praised PM Modi's China visit. He highlighted India's diplomatic skill in reshaping geopolitical realities. The visit strengthened India's connection with the Shanghai Cooperation Organisation. BJP circles were excited over SCO'…,2025-09-01 22:22:12,The Times of India,https://timesofindia.indiatimes.com/india/modis-visit-to-strengthen-indias-ties-with-sco-rajnath/articleshow/123643729.cms,,,-1,-1,21,0.30000000000000004,1,1,High
Police attacked during raid in Kishanganj,"A police team in Kishanganj's Khagra area faced a violent attack during a raid related to a theft case, resulting in injuries to four personnel. A woman police officer was physically assaulted and abused. The attackers, including family members of the accused…",2025-09-07 17:12:24,The Times of India,https://timesofindia.indiatimes.com/city/patna/police-attacked-during-raid-in-kishanganj/articleshow/123749972.cms,,,0,-1,15,0.5,3,1,High
"Ahmedabad: Man hacked, run over & stabbed again in revenge; 2 held","In Ahmedabad, Naisal Thakor was brutally murdered in a revenge attack near Paldi police station. CCTV footage captured the gruesome scene where he was hacked, run over, and stabbed repeatedly by seven to eight men. Police suspect Ajay Thakor, whose brother Na…",2025-09-13 01:58:52,The Times of India,https://timesofindia.indiatimes.com/city/ahmedabad/ahmedabad-man-hacked-run-over-stabbed-again-in-revenge-2-held/articleshow/123862164.cms,,,7,-1,10,0.6666666666666667,5,1,High
How a broken washing machine dispute ended in the beheading of an Indian-origin motel owner in the US,"A motel manager, Chandra Mouli Nagamallaiah, was murdered in Dallas. Yordanis Cobos-Martinez attacked him with a machete. The incident occurred after a dispute over a washing machine. Surveillance footage showed the brutal attack. Cobos-Martinez has a crimina…",2025-09-12 06:34:10,The Times of India,https://economictimes.indiatimes.com/news/new-updates/how-a-broken-washing-machine-dispute-ended-in-the-beheading-of-an-indian-origin-motel-owner-in-the-us/articleshow/123845347.cms,,,7,-1,11,0.6333333333333333,5,1,High
"FBI Director Kash Patel: Online network may have plotted Charlie Kirk killing, 20+ users under probe","FBI Director Kash Patel said more than 20 people are under probe after the killing of Charlie Kirk. The case links to Discord chats and social media posts before the attack. The FBI is now checking messages, users, and evidence to find who else may have known…",2025-09-16 17:20:06,The Times of India,https://economictimes.indiatimes.com/news/international/us/fbi-director-kash-patel-online-network-may-have-plotted-charlie-kirk-killing-20-users-under-probe/articleshow/123927056.cms,,,1,-1,6,0.8,1,1,High
“Truly an honor to play with him”: Kingsley Coman opens up on sharing the pitch with Cristiano Ronaldo at Al Nassr,"Kingsley Coman, the dynamic French winger, has joined Al Nassr from Bayern Munich in a €35 million deal, signing until 2028. He expressed his excitement about playing alongside Cristiano Ronaldo, acknowledging Ronaldo's exceptional finishing skills. Their par…",2025-09-14 14:36:14,The Times of India,https://timesofindia.indiatimes.com/sports/saudi-football/news/truly-an-honor-to-play-with-him-kingsley-coman-opens-up-on-sharing-the-pitch-with-cristiano-ronaldo-at-al-nassr/articleshow/123883386.cms,,,-1,-1,8,0.7333333333333334,1,1,High
Criminals kill BEd student by slitting her throat in Muzaffarpur,"In a shocking incident in Muzaffarpur, Bihar, Tannu Kumari, a 22-year-old BEd student, was murdered in her rented home. Unidentified criminals broke into the house in Bahwal Bazar and slit her throat, also injuring her mother. Police investigation suggests th…",2025-09-16 12:22:50,The Times of India,https://timesofindia.indiatimes.com/city/patna/criminals-kill-bed-student-by-slitting-her-throat-in-muzaffarpur/articleshow/123923102.cms,,,7,-1,6,0.8,5,1,High
Trader’s daughter killed in Madhepura firing,"In a shocking incident, criminals fatally shot a 14-year-old girl, Parwati Kumari, in a Madhepura market. The attack occurred at Sahani Chowk in Puraini Market, targeting her father, a local trader. While he escaped, Parwati was struck in the head and succumb…",2025-09-19 12:50:48,The Times of India,https://timesofindia.indiatimes.com/city/patna/traders-daughter-killed-in-madhepura-firing/articleshow/123999446.cms,,,7,-1,3,0.9,1,1,High
"What we know about Matthew Ruth’s ex-girlfriend, who accused him of stalking her and torching her truck before he killed three officers?","In York County, Matthew James Ruth ambushed police officers. The incident occurred outside his ex-girlfriend's home. Officers were there to arrest him for stalking. Ruth opened fire, killing three officers. Two other officers were critically injured. Ruth was…",2025-09-19 05:39:42,The Times of India,https://economictimes.indiatimes.com/news/international/us/what-we-know-about-matthew-ruths-ex-girlfriend-who-accused-him-of-stalking-her-and-torching-her-truck-before-he-killed-three-officers/articleshow/123990716.cms,,,-1,-1,4,0.8666666666666667,1,1,High
Disturbing video shows Rampage Jackson's son Raja brutally assaulting pro wrestler Syko Stu with punches,"Independent wrestler Syko Stu was allegedly assaulted by Raja Jackson, son of Quinton ""Rampage"" Jackson, at a California indie wrestling event. The incident, streamed live, showed Jackson slamming Stu and delivering numerous punches, leading to serious injuri…",2025-08-24 09:32:29,The Times of India,https://economictimes.indiatimes.com/news/international/global-trends/us-news-disturbing-video-shows-rampage-jacksons-son-raja-brutally-assaulting-pro-wrestler-syko-stu-with-punches/articleshow/123482763.cms,,,3,-1,30,0.0,3,1,High
Watch: First-ever Russian naval drone strike sinks Ukraine’s largest warship since 2014,"Russia has sunk Ukraine’s reconnaissance ship Simferopol in the Danube River delta, its first confirmed use of a naval drone against a Ukrainian warship. The Ukrainian Navy confirmed one crew member was killed, several were injured, and others remain missing.…",2025-08-29 05:15:00,The Times of India,https://economictimes.indiatimes.com/news/defence/watch-first-ever-russian-naval-drone-strike-sinks-ukraines-largest-warship-since-2014/articleshow/123577037.cms,,,2,-1,25,0.16666666666666663,1,1,High
Charlie Kirk’s final moments: Haunting last words of Trump ally before he was shot dead at Utah Valley university,"Charlie Kirk was speaking at a debate hosted by his nonprofit political organization when he was fatally shot at a college in Utah. Immediately before the shooting, Kirk was taking questions for an audience member about mass shootings and gun violence.Videos …",2025-09-11 05:15:24,The Times of India,https://economictimes.indiatimes.com/news/international/global-trends/us-news-charlie-kirks-final-moments-haunting-last-words-of-trump-ally-before-he-was-shot-dead-at-utah-valley-university/articleshow/123822479.cms,,,1,-1,12,0.6,2,1,High
