title,description,publishedAt,source,url,lat,lon,semantic_cluster,geo_cluster,days_ago,recency_score,severity,risk_score,risk_level
"Who is Iryna Zarutska's boyfriend, and his reaction to the murder and the accused DeCarlos Brown Jr; all the details here","Iryna Zarutska, a Ukrainian refugee, was tragically stabbed to death on a Charlotte train. Her boyfriend, Stas Nikulytsia, shared his sorrow and criticized the suspect's prior release. Decarlos Brown Jr., a repeat offender, faces charges. Iryna fled Ukraine i…",2025-09-11 21:34:55,The Times of India,https://economictimes.indiatimes.com/news/international/us/who-is-iryna-zarutskas-boyfriend-and-his-reaction-to-the-murder-and-the-accused-decarlos-brown-jr-all-the-details-here/articleshow/123838379.cms,,,-1,-1,11,0.6333333333333333,5,1,High
Why did Raja violently assault Syko Stu? Father Quinton Jackson finally speaks out amid intense backlash,"Raja Jackson, son of Quinton ""Rampage"" Jackson, is facing severe criticism after a video surfaced showing him allegedly assaulting wrestler Syko Stu during a live-streamed Knokx Pro Wrestling event. The footage depicts Raja delivering multiple punches to Stu'…",2025-08-24 14:55:14,The Times of India,https://economictimes.indiatimes.com/news/international/global-trends/us-news-why-did-raja-violently-assault-syko-stu-father-quinton-jackson-finally-speaks-out-amid-intense-backlash/articleshow/123485581.cms,,,3,-1,29,0.033333333333333326,3,1,High
"Panthers sack employee for social media post mocking Charlie Kirk killing in Utah Valley University shooting. Here's what staffer said, Carolina Panthers full statement","Panthers sack employee for social media post mocking Charlie Kirk killing in Utah Valley University shooting. The football communications coordinator was dismissed after controversial comments surfaced online, sparking public backlash and team condemnation.",2025-09-11 17:19:03,The Times of India,https://economictimes.indiatimes.com/news/international/us/panthers-sack-employee-for-social-media-post-mocking-charlie-kirk-killing-in-utah-valley-university-shooting-carolina-panthers-fired-charlie-rock-assassination-turning-point-usa-donald-trump-medal-of-freedom-official-statement/articleshow/123835275.cms,,,1,-1,11,0.6333333333333333,1,1,High
'Scary horrible monster': Minneapolis school shooter’s deadly rampage linked to breakup shocker? Final days revealed,"The Minneapolis school shooter Robin Westman recently went through a breakup and was staying with a friend in St. Louis Park, Minnesota, a newly released search warrant revealed. Robin Westman killed two children in a Minneapolis school shooting and injured d…",2025-08-30 09:38:23,The Times of India,https://economictimes.indiatimes.com/news/international/global-trends/us-news-scary-horrible-monster-minneapolis-school-shooters-robin-westman-deadly-rampage-linked-to-breakup-shocker/articleshow/123599735.cms,,,1,-1,24,0.19999999999999996,1,1,High
"'Shocking, deeply regrettable': India on killing of journalists in Gaza","India's Ministry of External Affairs expressed shock and regret over the killing of journalists in southern Gaza following an Israeli strike on Nasser Hospital. The incident, which resulted in at least 21 deaths, including five journalists, has prompted calls…",2025-08-27 04:42:17,The Times of India,https://economictimes.indiatimes.com/news/india/shocking-deeply-regrettable-india-on-killing-of-journalists-in-gaza/articleshow/123538300.cms,,,2,-1,27,0.09999999999999998,1,1,High
Zelensky urges more Western pressure on Putin after deadly Russian attack,"Following a deadly Russian missile and drone attack on Kyiv that killed 23, including children, President Zelensky urged Western allies to send a ""strong joint signal"" to Putin to bring him to the negotiating table.",2025-08-29 04:09:52,The Times of India,https://economictimes.indiatimes.com/news/defence/zelensky-urges-more-western-pressure-on-putin-after-deadly-russian-attack/articleshow/123576224.cms,,,2,-1,25,0.16666666666666663,1,1,High
"Ukrainian MP Andriy Parubiy killed in Lviv in ""carefully planned"" shooting","Ukrainian lawmaker Andriy Parubiy was fatally shot in Lviv in what authorities are calling a premeditated attack. The former speaker of the Verkhovna Rada died before emergency services arrived, prompting condemnation from President Zelenskyy and European Par…",2025-08-31 01:54:07,The Times of India,https://economictimes.indiatimes.com/news/defence/ukrainian-mp-andriy-parubiy-killed-in-lviv-in-carefully-planned-shooting/articleshow/123609819.cms,,,-1,-1,23,0.23333333333333328,1,1,High
Inside Tren de Aragua: The drug lords Trump has marked while US sinks Caribbean vessel killing 11,The United States is fighting against Tren de Aragua. It is a dangerous drug cartel from Latin America. The US military attacked the cartel's drug boat. The leader of the cartel is Hector Rusthenford Guerrero Flores. He is also known as Nino Guerrero. The US …,2025-09-03 16:31:43,The Times of India,https://economictimes.indiatimes.com/news/international/us/inside-tren-de-aragua-the-drug-lords-trump-has-marked-while-us-sinks-caribbean-vessel-killing-11/articleshow/123680812.cms,,,8,-1,19,0.3666666666666667,1,1,High
"Russia hits Kyiv with drones and missiles, killing 2 people","A massive Russian drone and missile attack struck Kyiv, resulting in casualties. Two people died, including a one-year-old child. Eleven individuals sustained injuries. Smoke rose from the cabinet of ministers building. Fire erupted in an administrative build…",2025-09-07 04:20:42,The Times of India,https://economictimes.indiatimes.com/news/international/world-news/russia-hits-kyiv-with-drones-and-missiles-smoke-seen-rising-from-ukraines-cabinet-building/articleshow/123742793.cms,,,2,-1,16,0.4666666666666667,1,1,High
"US prepares for a new war, marines practice beach assault in Puerto Rico; a few hundred miles away Venezuela readies to hit back","In September 2025, the U.S. increased its military presence in the Caribbean, particularly near Venezuela, citing counter-narcotics operations. Venezuela responded with military exercises, denouncing U.S. actions as threats to its sovereignty. Tensions escala…",2025-09-18 04:36:29,The Times of India,https://economictimes.indiatimes.com/news/international/us/us-prepares-for-a-new-war-marines-practice-beach-assault-in-puerto-rico-a-few-hundred-miles-away-venezuela-readies-to-hit-back/articleshow/123963628.cms,,,-1,-1,5,0.8333333333333334,3,1,High
Israeli foreign minister calls for Hamas' surrender as military pounds Gaza,Israel urged Hamas to surrender. Military strikes persist in Gaza City. Hamas refuses to disarm. They propose hostage release for peace. Strikes killed 14 people. Buildings sheltering displaced Palestinians were hit. Protests in Israel demand a ceasefire and …,2025-09-07 18:53:28,The Times of India,https://economictimes.indiatimes.com/news/international/world-news/israeli-foreign-minister-calls-for-hamas-surrender-as-military-pounds-gaza/articleshow/123751834.cms,,,2,-1,15,0.5,1,1,High
Trump says 11 dead in US strike on drug-carrying boat from Venezuela,"President Donald Trump said that US forces had attacked a boat carrying drugs to the United States Tuesday, killing 11 ""narcoterrorists"" from a gang he alleged was controlled by leftist Venezuelan leader Nicolas Maduro. Trump initially announced at the White …",2025-09-03 00:52:23,The Times of India,https://economictimes.indiatimes.com/news/international/global-trends/trump-says-11-dead-in-us-strike-on-drug-carrying-boat-from-venezuela/articleshow/123667087.cms,,,8,-1,20,0.33333333333333337,1,1,High
Qatar bombing tests the limits of the Trump-Netanyahu alliance,"President Trump expressed displeasure after Israel's strike on Hamas in Doha, which killed a Qatari security agent and others, straining relations despite a strong alliance. The attack, ordered by Netanyahu without prior U.S. warning, angered Trump, though an…",2025-09-11 05:34:57,The Times of India,https://economictimes.indiatimes.com/news/defence/qatar-bombing-tests-the-limits-of-the-trump-netanyahu-alliance/articleshow/123822933.cms,,,2,-1,12,0.6,1,1,High
"New India enters into den of terrorists, kills them: Modi","Prime Minister Narendra Modi, addressing a rally in Madhya Pradesh on his 75th birthday, asserted that no nuclear threat can intimidate new India, which strikes directly at terrorists’ homes, while praising Sardar Patel’s legacy and Hyderabad’s historic integ…",2025-09-17 18:40:31,The Times of India,https://economictimes.indiatimes.com/news/india/new-india-enters-into-den-of-terrorists-kills-them-modi/articleshow/123953955.cms,,,-1,-1,5,0.8333333333333334,1,1,High
Manipur govt announces Rs 5 lakh ex gratia each for kin of 2 Assam Rifles jawans killed in ambush,The Manipur government has announced compensation following an ambush on Assam Rifles personnel. Rupees five lakh will be given to the families of the two deceased jawans. Rupees two lakh will be provided to each of the five injured personnel. The government …,2025-09-20 12:27:24,The Times of India,https://economictimes.indiatimes.com/news/defence/manipur-govt-announces-rs-5-lakh-ex-gratia-each-for-kin-of-2-assam-rifles-jawans-killed-in-ambush/articleshow/124015685.cms,,,4,-1,2,0.9333333333333333,1,1,High
Houthis vow 'vengeance' against Israel for killing Yemen PM,"A Houthi official has vowed retaliation against Israel following an Israeli airstrike in Sanaa that resulted in the death of Ahmed al-Rahawi, the Houthis' Prime Minister, along with several other ministers.",2025-08-31 04:56:51,The Times of India,https://economictimes.indiatimes.com/news/defence/houthis-vow-vengeance-against-israel-for-killing-yemen-pm/articleshow/123611279.cms,,,2,-1,23,0.23333333333333328,1,1,High
"Israel strikes a Gaza hospital twice, killing at least 20, including journalists and rescuers","Israeli strikes on Nasser Hospital in Gaza killed at least 20 people, including five journalists, and wounded scores more. The initial strike hit an upper floor, followed by a second strike on a stairwell as journalists and rescue workers arrived.",2025-08-26 01:45:28,The Times of India,https://economictimes.indiatimes.com/news/defence/israel-strikes-a-gaza-hospital-twice-killing-at-least-20-including-journalists-and-rescuers/articleshow/123514124.cms,,,2,-1,28,0.06666666666666665,1,1,High
Twelve soldiers killed in Pakistani Taliban attack: officials,"At least 12 soldiers were killed in an ambush by the Pakistani Taliban in northwest Pakistan on Saturday, local government and security officials told AFP. 00 am when ""armed men opened fire from both sides with heavy weapons"", killing 12 security personnel, a…",2025-09-13 07:01:02,The Times of India,https://economictimes.indiatimes.com/news/international/world-news/twelve-soldiers-killed-in-pakistani-taliban-attack-officials/articleshow/123865635.cms,,,2,-1,10,0.6666666666666667,1,1,High
Suspect in Charlie Kirk killing charged with aggravated murder and weapon and obstruction offenses,Tyler Robinson was charged with aggravated murder for the assassination of conservative activist Charlie Kirk at Utah Valley University. Robinson potentially faces the death penalty if convicted. He is also charged with felony discharge of a firearm and obstr…,2025-09-16 18:18:45,The Times of India,https://economictimes.indiatimes.com/news/international/world-news/suspect-in-charlie-kirk-killing-charged-with-aggravated-murder-and-weapon-and-obstruction-offenses/articleshow/123928354.cms,,,1,-1,6,0.8,5,1,High
"25 killed, over 600 injured in 'Gen-Z' agitation in Nepal","Violent anti-government protests led by the 'Gen Z' group in Nepal have resulted in at least 25 deaths, including three policemen. Security forces opened fire on protesters near the Parliament building, causing numerous casualties. In response to the escalati…",2025-09-10 13:35:56,The Times of India,https://economictimes.indiatimes.com/news/international/world-news/25-killed-over-600-injured-in-gen-z-agitation-in-nepal/articleshow/123810984.cms,,,2,-1,12,0.6,1,1,High
Hamas says five of its members were killed in Israeli attack on Doha,"Hamas reported that five of its members, including the son of Khalil al-Hayya, Hamas's Gaza chief, were killed in an Israeli attack in Doha. The group claimed that Israel's attempt to assassinate its ceasefire negotiation team had failed. A Hamas political bu…",2025-09-09 17:47:16,The Times of India,https://economictimes.indiatimes.com/news/international/world-news/hamas-says-five-of-its-members-were-killed-in-israeli-attack-on-doha/articleshow/123792011.cms,,,2,-1,13,0.5666666666666667,1,1,High
"Charlie Kirk Shooter and Murder Weapon Identified? FBI leads manhunt but will not release picture but why. Footwear impression, palm print, forearm imprints found","Charlie Kirk shooter and murder weapon identified by the FBI after the conservative activist was fatally shot at Utah Valley University. Officials recovered a bolt-action rifle, tracked suspect movements, and continue a nationwide manhunt.",2025-09-11 14:11:06,The Times of India,https://economictimes.indiatimes.com/news/international/us/charlie-kirk-shooter-and-murder-weapon-identified-fbi-leads-manhunt-but-will-not-release-picture-footwear-impression-palm-print-forearm-imprints-found-movements-escape-route-investigation-security-footage/articleshow/123832999.cms,,,1,-1,11,0.6333333333333333,5,1,High
"'When we take PoK back, our objective will be achieved...': Uma Bharti lauds Operation Sindoor","India launched Operation Sindoor on May 7 as a military response to the April 22 Pahalgam terror attack in which 26 people were killed. The Indian Armed Forces targeted terror infrastructure in Pakistan and Pakistan-occupied Kashmir, leading to the eliminatio…",2025-08-30 05:04:46,The Times of India,https://economictimes.indiatimes.com/news/politics-and-nation/when-we-take-pok-back-our-objective-will-be-achieved-uma-bharti-lauds-operation-sindoor/articleshow/123596266.cms,,,6,-1,24,0.19999999999999996,1,1,High
"New York-based doctor shares ways to clear the sticky layer of fat and cholesterol in arteries, a major cause of heart attack","Dr. Vassily Eliopoulos suggests that plaque buildup in arteries isn't always permanent and can potentially be reversed by addressing the root cause. He recommends advanced testing, a Mediterranean-style diet, regular exercise, sufficient sleep, and therapeuti…",2025-09-01 04:03:02,The Times of India,https://economictimes.indiatimes.com/news/new-updates/new-york-based-doctor-shares-ways-to-clear-the-sticky-layer-of-fat-and-cholesterol-in-arteries-a-major-cause-of-heart-attack/articleshow/123625582.cms,,,-1,-1,22,0.2666666666666667,5,1,High
Luigi Mangione secures big win in UnitedHealthcare CEO Brian Thompson shooting case: Here's what the judge said,"Luigi Mangione, accused of fatally shooting UnitedHealthcare CEO Brian Thompson, saw terrorism charges dismissed by a New York judge. Judge Gregory Carro allowed a second-degree murder charge to stand, setting the stage for a December 2024 trial. Despite faci…",2025-09-16 14:57:20,The Times of India,https://economictimes.indiatimes.com/news/international/global-trends/us-news-luigi-mangione-secures-big-win-in-unitedhealthcare-ceo-brian-thompson-shooting-case-heres-what-the-judge-said/articleshow/123925554.cms,,,-1,-1,6,0.8,5,1,High
